{
  "schema_version": 2,
  "resource_kind": "authority_set",
  "resource_id": "us.federal.authorities.criminal-rules",
  "source_cutoff": "2026-08-11",
  "authorities": [
    {
      "authority_id": "us.federal.authority.frcrp-32-sentencing",
      "authority_type": "rule",
      "jurisdiction_id": "us.federal",
      "issuing_body_id": "us.courts.supreme-court",
      "precedential_status": "not_applicable",
      "official_source": true,
      "citation": "Fed. R. Crim. P. 32",
      "source_version": "2025-12-01",
      "checked_on": "2026-08-11",
      "locator": "Rule 32",
      "source_url": "https://www.uscourts.gov/sites/default/files/document/federal-rules-of-criminal-procedure.pdf",
      "proposition": "Rule 32 governs sentencing and requires the court to address the defendant personally before imposing sentence."
    }
  ]
}
