{
  "schema_version": 2,
  "resource_kind": "authority_set",
  "resource_id": "ca4m4.ellison.authorities.case-specific",
  "source_cutoff": "2026-08-12",
  "authorities": [
    {
      "authority_id": "ca4m4.ellison.authority.section-1983",
      "authority_type": "statute",
      "jurisdiction_id": "us.federal",
      "issuing_body_id": "us.congress",
      "precedential_status": "not_applicable",
      "official_source": true,
      "citation": "42 U.S.C. § 1983",
      "source_version": "2026-08-12",
      "checked_on": "2026-08-12",
      "locator": "Section 1983",
      "source_url": "https://uscode.house.gov/view.xhtml?req=granuleid:USC-prelim-title42-section1983",
      "proposition": "Section 1983 supplies a civil action against a person who, under color of state law, causes the deprivation of a right secured by the Constitution or federal law; it does not itself define the Fourth Amendment force standard or eliminate a properly established immunity defense."
    },
    {
      "authority_id": "ca4m4.ellison.authority.graham-force-totality",
      "authority_type": "case",
      "jurisdiction_id": "us.federal",
      "issuing_body_id": "us.courts.supreme-court",
      "precedential_status": "precedential",
      "official_source": true,
      "citation": "Graham v. Connor, 490 U.S. 386 (1989)",
      "source_version": "1989-05-15",
      "checked_on": "2026-08-12",
      "locator": "Official United States Reports pages 394-397",
      "source_url": "https://www.govinfo.gov/content/pkg/USREPORTS-490/pdf/USREPORTS-490-386.pdf",
      "proposition": "Force used during a seizure is judged for objective reasonableness under the Fourth Amendment from the perspective of an officer on the scene, considering the circumstances of the particular encounter rather than hindsight or the officer's subjective intent."
    },
    {
      "authority_id": "ca4m4.ellison.authority.johnson-evidence-sufficiency",
      "authority_type": "case",
      "jurisdiction_id": "us.federal",
      "issuing_body_id": "us.courts.supreme-court",
      "precedential_status": "precedential",
      "official_source": true,
      "citation": "Johnson v. Jones, 515 U.S. 304 (1995)",
      "source_version": "1995-06-12",
      "checked_on": "2026-08-12",
      "locator": "Official United States Reports pages 313-320",
      "source_url": "https://www.govinfo.gov/content/pkg/USREPORTS-515/pdf/USREPORTS-515-304.pdf",
      "proposition": "A summary-judgment order that determines only whether the evidence presents a genuine factual dispute in a qualified-immunity case is not immediately appealable under the collateral-order doctrine."
    },
    {
      "authority_id": "ca4m4.ellison.authority.barricks-collateral-boundary",
      "authority_type": "case",
      "jurisdiction_id": "us.ca4",
      "issuing_body_id": "us.ca4.court.appeals",
      "precedential_status": "precedential",
      "official_source": true,
      "citation": "Barricks v. Wright, No. 25-1250 (4th Cir. Mar. 3, 2026)",
      "source_version": "2026-03-03",
      "checked_on": "2026-08-12",
      "locator": "Official slip opinion pages 6-8 and 12",
      "source_url": "https://www.ca4.uscourts.gov/opinions/251250.P.pdf",
      "proposition": "On an interlocutory appeal from a qualified-immunity denial, the court lacks jurisdiction to revisit the district court's evidence-sufficiency assessment but may decide the legal immunity question after accepting the plaintiff-favorable facts identified below."
    },
    {
      "authority_id": "ca4m4.ellison.authority.barricks-assumed-facts-law",
      "authority_type": "case",
      "jurisdiction_id": "us.ca4",
      "issuing_body_id": "us.ca4.court.appeals",
      "precedential_status": "precedential",
      "official_source": true,
      "citation": "Barricks v. Wright, No. 25-1250 (4th Cir. Mar. 3, 2026)",
      "source_version": "2026-03-03",
      "checked_on": "2026-08-12",
      "locator": "Official slip opinion pages 8-12",
      "source_url": "https://www.ca4.uscourts.gov/opinions/251250.P.pdf",
      "proposition": "Accepting plaintiff-favorable facts, force must be evaluated against offense severity, immediate threat, resistance, flight, and materially changing circumstances; preexisting Fourth Circuit decisions can clearly establish that gratuitous injurious force against a surrendered or nonthreatening person is forbidden."
    },
    {
      "authority_id": "ca4m4.ellison.authority.armstrong-proportional-danger",
      "authority_type": "case",
      "jurisdiction_id": "us.ca4",
      "issuing_body_id": "us.ca4.court.appeals",
      "precedential_status": "precedential",
      "official_source": true,
      "citation": "Estate of Armstrong ex rel. Armstrong v. Village of Pinehurst, 810 F.3d 892 (4th Cir. 2016)",
      "source_version": "2016-01-11",
      "checked_on": "2026-08-12",
      "locator": "Official slip opinion pages 8-16",
      "source_url": "https://www.ca4.uscourts.gov/opinions/151191.P.pdf",
      "proposition": "Resistance is not synonymous with immediate danger. Serious force such as a conducted-energy weapon must be proportionate to a reasonably perceived safety risk, including during a protective mental-health seizure involving a stationary and nonviolent person."
    },
    {
      "authority_id": "ca4m4.ellison.authority.armstrong-prospective-notice",
      "authority_type": "case",
      "jurisdiction_id": "us.ca4",
      "issuing_body_id": "us.ca4.court.appeals",
      "precedential_status": "precedential",
      "official_source": true,
      "citation": "Estate of Armstrong ex rel. Armstrong v. Village of Pinehurst, 810 F.3d 892 (4th Cir. 2016)",
      "source_version": "2016-01-11",
      "checked_on": "2026-08-12",
      "locator": "Official slip opinion pages 16-20",
      "source_url": "https://www.ca4.uscourts.gov/opinions/151191.P.pdf",
      "proposition": "Although the Armstrong officers received qualified immunity for their 2011 conduct, the published decision gave later officers prospective notice that serious electrical force is disproportionate when resistance poses no immediate danger; application still turns on the specific assumed facts and force magnitude."
    },
    {
      "authority_id": "ca4m4.ellison.authority.smith-modest-movement-force",
      "authority_type": "case",
      "jurisdiction_id": "us.ca4",
      "issuing_body_id": "us.ca4.court.appeals",
      "precedential_status": "precedential",
      "official_source": true,
      "citation": "Smith v. Ray, 781 F.3d 95 (4th Cir. 2015)",
      "source_version": "2015-03-18",
      "checked_on": "2026-08-12",
      "locator": "No. 12-1503, official slip opinion pages 11-20",
      "source_url": "https://www.ca4.uscourts.gov/opinions/121503.P.pdf",
      "proposition": "Viewing the facts for the plaintiff, an officer could not convert a nonviolent encounter and a person's slight, frightened resistance to an officer's initial aggression into justification for throwing her down, driving a knee into her back, and wrenching her arm; the unlawfulness was clearly established despite factual differences from prior cases."
    },
    {
      "authority_id": "ca4m4.ellison.authority.meyers-changing-threat",
      "authority_type": "case",
      "jurisdiction_id": "us.ca4",
      "issuing_body_id": "us.ca4.court.appeals",
      "precedential_status": "precedential",
      "official_source": true,
      "citation": "Meyers v. Baltimore County, 713 F.3d 723 (4th Cir. 2013)",
      "source_version": "2013-02-01",
      "checked_on": "2026-08-12",
      "locator": "No. 11-2192, official slip opinion pages 13-18",
      "source_url": "https://www.ca4.uscourts.gov/opinions/112192.P.pdf",
      "proposition": "Even when initial conducted-energy-weapon uses reasonably answer an armed and actively resisting threat, additional shocks become excessive after the subject is disarmed, surrounded, no longer actively resisting, and no longer poses a continuing safety threat."
    },
    {
      "authority_id": "ca4m4.ellison.authority.yates-nonthreatening-taser-notice",
      "authority_type": "case",
      "jurisdiction_id": "us.ca4",
      "issuing_body_id": "us.ca4.court.appeals",
      "precedential_status": "precedential",
      "official_source": true,
      "citation": "Yates v. Terry, 817 F.3d 877 (4th Cir. 2016)",
      "source_version": "2016-03-31",
      "checked_on": "2026-08-12",
      "locator": "No. 15-1555, official slip opinion pages 10-18",
      "source_url": "https://www.ca4.uscourts.gov/opinions/151555.P.pdf",
      "proposition": "It was clearly established that an officer may not repeatedly tase a nonviolent misdemeanant who is compliant, not actively resisting, and poses no safety threat; minor noncompliance does not automatically justify escalating electrical force."
    },
    {
      "authority_id": "ca4m4.ellison.authority.zorn-specificity-warning",
      "authority_type": "case",
      "jurisdiction_id": "us.federal",
      "issuing_body_id": "us.courts.supreme-court",
      "precedential_status": "precedential",
      "official_source": true,
      "citation": "Zorn v. Linton, 607 U.S. ___ (2026)",
      "source_version": "2026-03-23",
      "checked_on": "2026-08-12",
      "locator": "Official slip opinion pages 3-6",
      "source_url": "https://www.supremecourt.gov/opinions/25pdf/25-297_bqm2.pdf",
      "proposition": "Clearly established law requires precedent addressing sufficiently similar conduct with a high degree of specificity; a repeatedly warned, routine wristlock used to move a resistant protester did not become clearly unlawful from precedent addressing materially more aggressive conduct. Zorn postdates the February 3, 2025 Ellison encounter and therefore cannot itself supply notice at that time."
    }
  ]
}
