{
  "schema_version": 2,
  "resource_kind": "authority_set",
  "resource_id": "ca4m4.norvale.authorities.case-specific",
  "source_cutoff": "2026-08-12",
  "authorities": [
    {
      "authority_id": "ca4m4.norvale.authority.usc-1292a1",
      "authority_type": "statute",
      "jurisdiction_id": "us.federal",
      "issuing_body_id": "us.congress",
      "precedential_status": "not_applicable",
      "official_source": true,
      "citation": "28 U.S.C. § 1292(a)(1)",
      "source_version": "2026-08-12",
      "checked_on": "2026-08-12",
      "locator": "Section 1292(a)(1)",
      "source_url": "https://uscode.house.gov/view.xhtml?edition=prelim&num=0&req=granuleid%3AUSC-prelim-title28-section1292%28a%29%281%29",
      "proposition": "The courts of appeals have jurisdiction over interlocutory district-court orders granting, continuing, modifying, refusing, or dissolving injunctions, or refusing to dissolve or modify injunctions."
    },
    {
      "authority_id": "ca4m4.norvale.authority.local-rule-8-district-first",
      "authority_type": "rule",
      "jurisdiction_id": "us.ca4",
      "issuing_body_id": "us.ca4.court.appeals",
      "precedential_status": "not_applicable",
      "official_source": true,
      "citation": "Fed. R. App. P. 8(a); 4th Cir. R. 8",
      "source_version": "2026-03-23",
      "checked_on": "2026-08-12",
      "locator": "Rule 8(a)(1)-(2) and Local Rule 8",
      "source_url": "https://www.ca4.uscourts.gov/rules/Rule08.html",
      "proposition": "A party ordinarily must first seek a stay or injunction from the district court; a circuit motion must show that district-court relief would be impracticable or state that relief was sought and denied with the district court's reasons, and must include supporting record materials and sworn facts when disputed."
    },
    {
      "authority_id": "ca4m4.norvale.authority.billups-protected-paid-speech",
      "authority_type": "case",
      "jurisdiction_id": "us.ca4",
      "issuing_body_id": "us.ca4.court.appeals",
      "precedential_status": "precedential",
      "official_source": true,
      "citation": "Billups v. City of Charleston, 961 F.3d 673 (4th Cir. 2020)",
      "source_version": "2020-06-11",
      "checked_on": "2026-08-12",
      "locator": "Official slip opinion pages 14-19",
      "source_url": "https://www.ca4.uscourts.gov/opinions/191044.P.pdf",
      "proposition": "Paid tour-guide speech is protected by the First Amendment, and a licensing requirement that burdens protected expression in public streets and sidewalks is subject to constitutional scrutiny even when framed as an occupational rule."
    },
    {
      "authority_id": "ca4m4.norvale.authority.billups-narrow-tailoring",
      "authority_type": "case",
      "jurisdiction_id": "us.ca4",
      "issuing_body_id": "us.ca4.court.appeals",
      "precedential_status": "precedential",
      "official_source": true,
      "citation": "Billups v. City of Charleston, 961 F.3d 673 (4th Cir. 2020)",
      "source_version": "2020-06-11",
      "checked_on": "2026-08-12",
      "locator": "Official slip opinion pages 19-30",
      "source_url": "https://www.ca4.uscourts.gov/opinions/191044.P.pdf",
      "proposition": "For a content-neutral speech restriction, the government bears the burden to establish narrow tailoring with evidence connecting the chosen burden to its asserted interests and accounting for substantially less restrictive alternatives."
    },
    {
      "authority_id": "ca4m4.norvale.authority.pashby-winter-review",
      "authority_type": "case",
      "jurisdiction_id": "us.ca4",
      "issuing_body_id": "us.ca4.court.appeals",
      "precedential_status": "precedential",
      "official_source": true,
      "citation": "Pashby v. Delia, 709 F.3d 307 (4th Cir. 2013)",
      "source_version": "2013-03-05",
      "checked_on": "2026-08-12",
      "locator": "Official slip opinion pages 11-15 and 32-33",
      "source_url": "https://www.ca4.uscourts.gov/opinions/Published/112363.p.pdf",
      "proposition": "A preliminary-injunction movant must clearly establish each Winter factor; legal conclusions are reviewed de novo, factual findings for clear error, and the ultimate preliminary-injunction decision for abuse of discretion."
    },
    {
      "authority_id": "ca4m4.norvale.authority.pashby-rule65-cd-remand",
      "authority_type": "case",
      "jurisdiction_id": "us.ca4",
      "issuing_body_id": "us.ca4.court.appeals",
      "precedential_status": "precedential",
      "official_source": true,
      "citation": "Pashby v. Delia, 709 F.3d 307 (4th Cir. 2013)",
      "source_version": "2013-03-05",
      "checked_on": "2026-08-12",
      "locator": "Official slip opinion pages 33-35",
      "source_url": "https://www.ca4.uscourts.gov/opinions/Published/112363.p.pdf",
      "proposition": "Rules 65(c) and 65(d) require an express security determination and an injunction stated in reasonably specific terms; corrective remand may leave warranted interim protection in force until the district court enters a superseding compliant order."
    },
    {
      "authority_id": "ca4m4.norvale.authority.nken-stay-factors",
      "authority_type": "case",
      "jurisdiction_id": "us.federal",
      "issuing_body_id": "us.courts.supreme-court",
      "precedential_status": "precedential",
      "official_source": true,
      "citation": "Nken v. Holder, 556 U.S. 418 (2009)",
      "source_version": "2009-04-22",
      "checked_on": "2026-08-12",
      "locator": "Official United States Reports pages 425-436",
      "source_url": "https://www.govinfo.gov/content/pkg/USREPORTS-556/pdf/USREPORTS-556-418.pdf",
      "proposition": "A stay is discretionary relief governed by likelihood of success, irreparable injury to the movant, substantial injury to other parties, and the public interest; the first two factors are the most critical."
    },
    {
      "authority_id": "ca4m4.norvale.authority.robinson-recurring-mootness",
      "authority_type": "case",
      "jurisdiction_id": "us.ca4",
      "issuing_body_id": "us.ca4.court.appeals",
      "precedential_status": "precedential",
      "official_source": true,
      "citation": "Robinson v. National Collegiate Athletic Ass'n, No. 25-2003 (4th Cir. Apr. 3, 2026)",
      "source_version": "2026-04-03",
      "checked_on": "2026-08-12",
      "locator": "Official slip opinion pages 10-15",
      "source_url": "https://www.ca4.uscourts.gov/opinions/252003.P.pdf",
      "proposition": "Expiration of one short recurring event does not necessarily moot a dispute where the challenged rule remains operative and the same party is reasonably expected to face the same time-limited controversy again."
    }
  ]
}
