{
  "schema_version": 2,
  "resource_kind": "authority_set",
  "resource_id": "ca4m4.benton.authorities.case-specific",
  "source_cutoff": "2026-08-11",
  "authorities": [
    {
      "authority_id": "ca4m4.benton.authority.title-vii-retaliation",
      "authority_type": "statute",
      "jurisdiction_id": "us.federal",
      "issuing_body_id": "us.congress",
      "precedential_status": "not_applicable",
      "official_source": true,
      "citation": "42 U.S.C. § 2000e-3(a)",
      "source_version": "2026-08-11",
      "checked_on": "2026-08-11",
      "locator": "Section 2000e-3(a)",
      "source_url": "https://uscode.house.gov/view.xhtml?req=%28title%3A42+section%3A2000e-3+edition%3Aprelim%29",
      "proposition": "Title VII prohibits employer discrimination because an individual opposed an unlawful Title VII practice or participated in a Title VII investigation, proceeding, or hearing."
    },
    {
      "authority_id": "ca4m4.benton.authority.foster-framework",
      "authority_type": "case",
      "jurisdiction_id": "us.ca4",
      "issuing_body_id": "us.ca4.court.appeals",
      "precedential_status": "precedential",
      "official_source": true,
      "citation": "Foster v. University of Maryland-Eastern Shore, 787 F.3d 243 (4th Cir. 2015)",
      "source_version": "2015-05-21",
      "checked_on": "2026-08-11",
      "locator": "Part III.B, PDF pages 17-20",
      "source_url": "https://www.ca4.uscourts.gov/opinions/published/141073.p.pdf",
      "proposition": "Nassar does not alter the prima-facie causation prong or displace the McDonnell Douglas framework for a Title VII retaliation claim proceeding through pretext."
    },
    {
      "authority_id": "ca4m4.benton.authority.foster-pretext",
      "authority_type": "case",
      "jurisdiction_id": "us.ca4",
      "issuing_body_id": "us.ca4.court.appeals",
      "precedential_status": "precedential",
      "official_source": true,
      "citation": "Foster v. University of Maryland-Eastern Shore, 787 F.3d 243 (4th Cir. 2015)",
      "source_version": "2015-05-21",
      "checked_on": "2026-08-11",
      "locator": "Parts III.B-C, PDF pages 18-23",
      "source_url": "https://www.ca4.uscourts.gov/opinions/published/141073.p.pdf",
      "proposition": "At pretext a retaliation plaintiff must show retaliation was the real reason and therefore a but-for cause; timing and evidence making stated reasons questionable can create a jury issue."
    },
    {
      "authority_id": "ca4m4.benton.authority.frcp-56-summary-judgment",
      "authority_type": "rule",
      "jurisdiction_id": "us.federal",
      "issuing_body_id": "us.courts.supreme-court",
      "precedential_status": "not_applicable",
      "official_source": true,
      "citation": "Fed. R. Civ. P. 56(a), (c)",
      "source_version": "2025-12-01",
      "checked_on": "2026-08-11",
      "locator": "Rule 56(a) and (c)",
      "source_url": "https://www.uscourts.gov/sites/default/files/document/federal-rules-of-civil-procedure.pdf",
      "proposition": "Summary judgment requires no genuine dispute of material fact and entitlement to judgment as a matter of law on record materials the rule permits the parties to cite."
    },
    {
      "authority_id": "ca4m4.benton.authority.frcp-26e-supplementation",
      "authority_type": "rule",
      "jurisdiction_id": "us.federal",
      "issuing_body_id": "us.courts.supreme-court",
      "precedential_status": "not_applicable",
      "official_source": true,
      "citation": "Fed. R. Civ. P. 26(e)(1)",
      "source_version": "2025-12-01",
      "checked_on": "2026-08-11",
      "locator": "Rule 26(e)(1)",
      "source_url": "https://www.uscourts.gov/sites/default/files/document/federal-rules-of-civil-procedure.pdf",
      "proposition": "A party must timely supplement or correct a materially incomplete or incorrect disclosure or response when the additional information has not otherwise been made known during discovery or in writing."
    },
    {
      "authority_id": "ca4m4.benton.authority.frcp-37c1-nondisclosure",
      "authority_type": "rule",
      "jurisdiction_id": "us.federal",
      "issuing_body_id": "us.courts.supreme-court",
      "precedential_status": "not_applicable",
      "official_source": true,
      "citation": "Fed. R. Civ. P. 37(c)(1)",
      "source_version": "2025-12-01",
      "checked_on": "2026-08-11",
      "locator": "Rule 37(c)(1)",
      "source_url": "https://www.uscourts.gov/sites/default/files/document/federal-rules-of-civil-procedure.pdf",
      "proposition": "Absent substantial justification or harmlessness, a party that fails to disclose or supplement as required may not use the information or witness on a motion, at a hearing, or at trial, in addition to other listed sanctions."
    }
  ]
}
