{
  "schema_version": 2,
  "resource_kind": "authority_set",
  "resource_id": "ca4m4.opengrid.authorities.case-specific",
  "source_cutoff": "2026-08-19",
  "authorities": [
    {
      "authority_id": "ca4m4.opengrid.authority.section-1291-final-judgment",
      "authority_type": "statute",
      "jurisdiction_id": "us.federal",
      "issuing_body_id": "us.congress",
      "precedential_status": "not_applicable",
      "official_source": true,
      "citation": "28 U.S.C. § 1291",
      "source_version": "2026-07-29",
      "checked_on": "2026-08-19",
      "locator": "Section 1291, preliminary edition current through July 29, 2026",
      "source_url": "https://uscode.house.gov/view.xhtml?edition=prelim&num=0&req=granuleid:USC-prelim-title28-section1291",
      "proposition": "The courts of appeals have jurisdiction over appeals from final decisions of the district courts, subject to statutory exceptions not implicated by the final judgment in this synthetic FOIA action."
    },
    {
      "authority_id": "ca4m4.opengrid.authority.foia-disclosure-exemptions-segregability",
      "authority_type": "statute",
      "jurisdiction_id": "us.federal",
      "issuing_body_id": "us.congress",
      "precedential_status": "not_applicable",
      "official_source": true,
      "citation": "5 U.S.C. § 552(a)(8)(A), (b)(7)(E)-(F), and (b) concluding paragraph",
      "source_version": "2026-07-29",
      "checked_on": "2026-08-19",
      "locator": "Section 552(a)(8)(A), (b)(7)(E)-(F), and the reasonably-segregable sentence following subsection (b)(9), preliminary edition current through July 29, 2026",
      "source_url": "https://uscode.house.gov/view.xhtml?edition=prelim&req=granuleid:USC-prelim-title5-section552",
      "proposition": "FOIA permits withholding law-enforcement records to the extent production would disclose investigation or prosecution techniques and procedures, or guidelines whose disclosure could reasonably be expected to risk circumvention of law, and to the extent production could reasonably be expected to endanger an individual's life or physical safety. An agency also must disclose reasonably segregable nonexempt portions and ordinarily may withhold only when it reasonably foresees harm to an interest protected by an exemption or disclosure is prohibited by law."
    },
    {
      "authority_id": "ca4m4.opengrid.authority.dmd-local-rule-105-11-sealing",
      "authority_type": "rule",
      "jurisdiction_id": "us.md",
      "issuing_body_id": "us.mdd.court.district",
      "precedential_status": "not_applicable",
      "official_source": true,
      "citation": "D. Md. Local Rule 105.11",
      "source_version": "2025-12-01",
      "checked_on": "2026-08-19",
      "locator": "Local Rule 105.11, official Local Rules pages 18-19",
      "source_url": "https://www.mdd.uscourts.gov/sites/mdd/files/LocalRules.pdf",
      "proposition": "A sealing motion must offer specific factual representations supporting sealing and explain why alternatives would not provide sufficient protection. The court may not rule until at least fourteen days after the motion enters the public docket so interested parties may object; the materials remain temporarily sealed pending a ruling, and the filer may withdraw them if sealing is denied."
    },
    {
      "authority_id": "ca4m4.opengrid.authority.grey-7e-techniques-guidelines",
      "authority_type": "case",
      "jurisdiction_id": "us.ca4",
      "issuing_body_id": "us.ca4.court.appeals",
      "precedential_status": "precedential",
      "official_source": true,
      "citation": "Grey v. Alfonso-Royals, 140 F.4th 173 (4th Cir. 2025)",
      "source_version": "2025-06-10",
      "checked_on": "2026-08-19",
      "locator": "No. 23-1910, official slip opinion pages 7-10",
      "source_url": "https://www.ca4.uscourts.gov/opinions/231910.P.pdf",
      "proposition": "Training and operational records can satisfy Exemption 7's law-enforcement-purpose threshold. Exemption 7(E) protects nonpublic implementation details of law-enforcement techniques or procedures even when the general technique is publicly known; the statutory risk-of-circumvention qualifier modifies guidelines, not techniques and procedures."
    },
    {
      "authority_id": "ca4m4.opengrid.authority.rein-vaughn-segregability",
      "authority_type": "case",
      "jurisdiction_id": "us.ca4",
      "issuing_body_id": "us.ca4.court.appeals",
      "precedential_status": "precedential",
      "official_source": true,
      "citation": "Rein v. U.S. Patent & Trademark Office, 553 F.3d 353 (4th Cir. 2009)",
      "source_version": "2009-01-28",
      "checked_on": "2026-08-19",
      "locator": "No. 07-1738, official slip opinion pages 19-26 and 33-36",
      "source_url": "https://www.ca4.uscourts.gov/opinions/071738.P.pdf",
      "proposition": "An agency must describe withheld material and the claimed exemption with enough specificity to permit adversarial testing and meaningful de novo review. The agency also bears the segregability burden and must show that it disclosed all reasonably segregable nonexempt information rather than rely on a conclusory declaration."
    },
    {
      "authority_id": "ca4m4.opengrid.authority.zaid-categorical-proof",
      "authority_type": "case",
      "jurisdiction_id": "us.ca4",
      "issuing_body_id": "us.ca4.court.appeals",
      "precedential_status": "precedential",
      "official_source": true,
      "citation": "Zaid v. U.S. Department of Justice, 96 F.4th 697 (4th Cir. 2024)",
      "source_version": "2024-03-25",
      "checked_on": "2026-08-19",
      "locator": "No. 23-1821, official slip opinion pages 9-16",
      "source_url": "https://www.ca4.uscourts.gov/opinions/231821.P.pdf",
      "proposition": "FOIA exemption rulings receive de novo review, and the agency bears the burden of proving withheld material fits an exemption on an adequate factual basis. A categorical presentation remains permissible only when founded on document-by-document review and meaningful functional categories tied to the protected interest and the asserted disclosure harm."
    },
    {
      "authority_id": "ca4m4.opengrid.authority.peer-critical-infrastructure",
      "authority_type": "case",
      "jurisdiction_id": "us.cadc",
      "issuing_body_id": "us.cadc.court.appeals",
      "precedential_status": "precedential",
      "official_source": true,
      "citation": "Public Employees for Environmental Responsibility v. U.S. Section, International Boundary & Water Commission, 740 F.3d 195 (D.C. Cir. 2014)",
      "source_version": "2014-01-22",
      "checked_on": "2026-08-19",
      "locator": "No. 12-5158, official slip opinion pages 9-17",
      "source_url": "https://media.cadc.uscourts.gov/opinions/docs/2014/01/12-5158-1476059.pdf",
      "proposition": "Emergency-response records for critical infrastructure may be compiled for a law-enforcement purpose when they address prevention of and response to criminal threats. Exemptions 7(E) and 7(F) still require a concrete explanation linking disclosure of the particular operational information to circumvention or a reasonable threat to physical safety."
    },
    {
      "authority_id": "ca4m4.opengrid.authority.epic-7f-and-segregability",
      "authority_type": "case",
      "jurisdiction_id": "us.cadc",
      "issuing_body_id": "us.cadc.court.appeals",
      "precedential_status": "precedential",
      "official_source": true,
      "citation": "Electronic Privacy Information Center v. U.S. Department of Homeland Security, 777 F.3d 518 (D.C. Cir. 2015)",
      "source_version": "2015-02-10",
      "checked_on": "2026-08-19",
      "locator": "No. 14-5013, official slip opinion pages 1 and 8-16",
      "source_url": "https://media.cadc.uscourts.gov/opinions/docs/2015/02/14-5013-1536791.pdf",
      "proposition": "Exemption 7(F) does not require an agency to identify threatened people by name, but the agency must demonstrate that disclosure could reasonably be expected to endanger some individual's life or physical safety. A valid 7(F) showing does not dispense with a distinct, supported segregability determination."
    },
    {
      "authority_id": "ca4m4.opengrid.authority.company-doe-sealing",
      "authority_type": "case",
      "jurisdiction_id": "us.ca4",
      "issuing_body_id": "us.ca4.court.appeals",
      "precedential_status": "precedential",
      "official_source": true,
      "citation": "Company Doe v. Public Citizen, 749 F.3d 246 (4th Cir. 2014)",
      "source_version": "2014-04-16",
      "checked_on": "2026-08-19",
      "locator": "No. 12-2209, official slip opinion pages 36-54",
      "source_url": "https://www.ca4.uscourts.gov/Opinions/Published/122209.P.pdf",
      "proposition": "Before sealing judicial records, a court must identify the governing source of public access, give public notice and an opportunity to object, consider less drastic alternatives, and make specific findings supporting closure. First Amendment sealing additionally demands a compelling interest and narrow tailoring, so an entire case or broad group of filings cannot be sealed merely because portions contain sensitive information."
    }
  ]
}
