{
  "schema_version": 2,
  "resource_kind": "authority_set",
  "resource_id": "ca4m4.arm.authorities.case-specific",
  "source_cutoff": "2026-08-11",
  "authorities": [
    {
      "authority_id": "ca4m4.arm.authority.usc-1252-record-limit",
      "authority_type": "statute",
      "jurisdiction_id": "us.federal",
      "issuing_body_id": "us.congress",
      "precedential_status": "not_applicable",
      "official_source": true,
      "citation": "8 U.S.C. § 1252(a)(1), (b)(4)(A)",
      "source_version": "2025-01-06",
      "checked_on": "2026-08-11",
      "locator": "2024 U.S. Code edition, codification PDF pages 337-338; subsections (a)(1) and (b)(4)(A)",
      "source_url": "https://www.govinfo.gov/content/pkg/USCODE-2024-title8/pdf/USCODE-2024-title8-chap12-subchapII-partV-sec1252.pdf",
      "proposition": "Judicial review of a final removal order proceeds under the specified review scheme; the reviewing court may not order additional evidence under 28 U.S.C. § 2347(c) and decides the petition only on the administrative record on which the order was based."
    },
    {
      "authority_id": "ca4m4.arm.authority.usc-1252-review-standard",
      "authority_type": "statute",
      "jurisdiction_id": "us.federal",
      "issuing_body_id": "us.congress",
      "precedential_status": "not_applicable",
      "official_source": true,
      "citation": "8 U.S.C. § 1252(b)(4)(B)",
      "source_version": "2025-01-06",
      "checked_on": "2026-08-11",
      "locator": "2024 U.S. Code edition, codification PDF page 338; subsection (b)(4)(B)",
      "source_url": "https://www.govinfo.gov/content/pkg/USCODE-2024-title8/pdf/USCODE-2024-title8-chap12-subchapII-partV-sec1252.pdf",
      "proposition": "Administrative findings of fact are conclusive unless any reasonable adjudicator would be compelled to conclude to the contrary."
    },
    {
      "authority_id": "ca4m4.arm.authority.usc-1252-deadline",
      "authority_type": "statute",
      "jurisdiction_id": "us.federal",
      "issuing_body_id": "us.congress",
      "precedential_status": "not_applicable",
      "official_source": true,
      "citation": "8 U.S.C. § 1252(b)(1), (b)(3)(C)",
      "source_version": "2025-01-06",
      "checked_on": "2026-08-11",
      "locator": "2024 U.S. Code edition, codification PDF page 338; subsections (b)(1) and (b)(3)(C)",
      "source_url": "https://www.govinfo.gov/content/pkg/USCODE-2024-title8/pdf/USCODE-2024-title8-chap12-subchapII-partV-sec1252.pdf",
      "proposition": "A petition for review must be filed not later than 30 days after the date of the final order of removal; the petitioner must serve and file an opening brief not later than 40 days after the administrative record is available, may serve and file a reply brief not later than 14 days after service of the Attorney General's brief, and may obtain an extension of either briefing deadline only on motion for good cause shown."
    },
    {
      "authority_id": "ca4m4.arm.authority.cfr-1208-cat-burden",
      "authority_type": "regulation",
      "jurisdiction_id": "us.federal",
      "issuing_body_id": "us.justice.eoir",
      "precedential_status": "not_applicable",
      "official_source": true,
      "citation": "8 C.F.R. § 1208.16(c)(2)",
      "source_version": "2025-01-01",
      "checked_on": "2026-08-11",
      "locator": "2025 annual edition, printed page 1050; subsection (c)(2)",
      "source_url": "https://www.govinfo.gov/content/pkg/CFR-2025-title8-vol1/pdf/CFR-2025-title8-vol1-part1208.pdf",
      "proposition": "An applicant for CAT withholding bears the burden to establish that the applicant is more likely than not to be tortured in the proposed country of removal."
    },
    {
      "authority_id": "ca4m4.arm.authority.cfr-1208-all-evidence",
      "authority_type": "regulation",
      "jurisdiction_id": "us.federal",
      "issuing_body_id": "us.justice.eoir",
      "precedential_status": "not_applicable",
      "official_source": true,
      "citation": "8 C.F.R. § 1208.16(c)(3)",
      "source_version": "2025-01-01",
      "checked_on": "2026-08-11",
      "locator": "2025 annual edition, printed pages 1050-1051; subsection (c)(3)",
      "source_url": "https://www.govinfo.gov/content/pkg/CFR-2025-title8-vol1/pdf/CFR-2025-title8-vol1-part1208.pdf",
      "proposition": "All evidence relevant to possible future torture must be considered, including evidence of past torture, relocation, gross or mass rights violations, and other country conditions."
    },
    {
      "authority_id": "ca4m4.arm.authority.cfr-1208-deferral",
      "authority_type": "regulation",
      "jurisdiction_id": "us.federal",
      "issuing_body_id": "us.justice.eoir",
      "precedential_status": "not_applicable",
      "official_source": true,
      "citation": "8 C.F.R. § 1208.17(a)",
      "source_version": "2025-01-01",
      "checked_on": "2026-08-11",
      "locator": "2025 annual edition, printed page 1053; subsection (a)",
      "source_url": "https://www.govinfo.gov/content/pkg/CFR-2025-title8-vol1/pdf/CFR-2025-title8-vol1-part1208.pdf",
      "proposition": "An applicant entitled to CAT protection but subject to the identified mandatory-denial provisions receives deferral of removal to the country where torture is more likely than not."
    },
    {
      "authority_id": "ca4m4.arm.authority.cfr-1208-torture-acquiescence",
      "authority_type": "regulation",
      "jurisdiction_id": "us.federal",
      "issuing_body_id": "us.justice.eoir",
      "precedential_status": "not_applicable",
      "official_source": true,
      "citation": "8 C.F.R. § 1208.18(a)(1), (7)",
      "source_version": "2025-01-01",
      "checked_on": "2026-08-11",
      "locator": "2025 annual edition, printed pages 1054-1055; subsections (a)(1) and (a)(7)",
      "source_url": "https://www.govinfo.gov/content/pkg/CFR-2025-title8-vol1/pdf/CFR-2025-title8-vol1-part1208.pdf",
      "proposition": "Torture includes qualifying severe intentional harm by, at the instigation of, or with consent or acquiescence of a public official acting officially; acquiescence requires awareness and breach of a duty to intervene, and awareness includes actual knowledge or willful blindness."
    },
    {
      "authority_id": "ca4m4.arm.authority.frap-16-record",
      "authority_type": "rule",
      "jurisdiction_id": "us.federal",
      "issuing_body_id": "us.courts.supreme-court",
      "precedential_status": "not_applicable",
      "official_source": true,
      "citation": "Fed. R. App. P. 16(a)-(b)",
      "source_version": "2025-12-01",
      "checked_on": "2026-08-11",
      "locator": "Rule 16(a)-(b), Composition of the Record; Omissions From or Misstatements in the Record",
      "source_url": "https://www.uscourts.gov/sites/default/files/document/federal-rules-of-appellate-procedure.pdf",
      "proposition": "The agency-review record consists of the agency order, findings or report, and agency pleadings, evidence, and proceedings; an omission or misstatement is corrected as directed by the court, and a supplemental record may be prepared and filed."
    },
    {
      "authority_id": "ca4m4.arm.authority.riley-claims-processing",
      "authority_type": "case",
      "jurisdiction_id": "us.federal",
      "issuing_body_id": "us.courts.supreme-court",
      "precedential_status": "precedential",
      "official_source": true,
      "citation": "Riley v. Bondi, 606 U.S. 259 (2025)",
      "source_version": "2025-06-26",
      "checked_on": "2026-08-11",
      "locator": "606 U.S. 263, 272-277; official preliminary print",
      "source_url": "https://www.supremecourt.gov/opinions/24pdf/606us1r58_5h25.pdf",
      "proposition": "Section 1252(b)(1)'s 30-day deadline is a nonjurisdictional claims-processing rule; such a matter is ordinarily forfeited if not timely raised, and the Court did not dismiss where the Government chose not to press the filing ground."
    },
    {
      "authority_id": "ca4m4.arm.authority.rodriguez-arias-aggregation",
      "authority_type": "case",
      "jurisdiction_id": "us.ca4",
      "issuing_body_id": "us.ca4.court.appeals",
      "precedential_status": "precedential",
      "official_source": true,
      "citation": "Rodriguez-Arias v. Whitaker, 915 F.3d 968 (4th Cir. 2019)",
      "source_version": "2019-02-12",
      "checked_on": "2026-08-11",
      "locator": "Part III, 915 F.3d at 974-977; official published PDF pages 7-10",
      "source_url": "https://www.ca4.uscourts.gov/opinions/172211.P.pdf",
      "proposition": "CAT risk from all feared sources must be considered in the aggregate rather than as separate, divisible claims."
    },
    {
      "authority_id": "ca4m4.arm.authority.rodriguez-arias-consideration",
      "authority_type": "case",
      "jurisdiction_id": "us.ca4",
      "issuing_body_id": "us.ca4.court.appeals",
      "precedential_status": "precedential",
      "official_source": true,
      "citation": "Rodriguez-Arias v. Whitaker, 915 F.3d 968 (4th Cir. 2019)",
      "source_version": "2019-02-12",
      "checked_on": "2026-08-11",
      "locator": "Part IV and conclusion, 915 F.3d at 977-980; official published PDF pages 10-13",
      "source_url": "https://www.ca4.uscourts.gov/opinions/172211.P.pdf",
      "proposition": "The agency may not arbitrarily ignore relevant, legally significant CAT evidence; failure to meaningfully engage the evidence hampers review and can require vacatur and remand."
    }
  ]
}
