{
  "schema_version": 2,
  "resource_kind": "authority_set",
  "resource_id": "ca4r54b.authorities.case-specific",
  "source_cutoff": "2026-08-12",
  "authorities": [
    {
      "authority_id": "ca4r54b.authority.usc-1291",
      "authority_type": "statute",
      "jurisdiction_id": "us.federal",
      "issuing_body_id": "us.congress",
      "precedential_status": "not_applicable",
      "official_source": true,
      "citation": "28 U.S.C. § 1291",
      "source_version": "2026-07-25",
      "checked_on": "2026-08-12",
      "locator": "Section 1291",
      "source_url": "https://uscode.house.gov/view.xhtml?edition=prelim&req=granuleid%3AUSC-prelim-title28-section1291",
      "proposition": "The courts of appeals have jurisdiction over final decisions of the district courts, subject to statutory exceptions."
    },
    {
      "authority_id": "ca4r54b.authority.usc-2107a",
      "authority_type": "statute",
      "jurisdiction_id": "us.federal",
      "issuing_body_id": "us.congress",
      "precedential_status": "not_applicable",
      "official_source": true,
      "citation": "28 U.S.C. § 2107(a)",
      "source_version": "2026-07-07",
      "checked_on": "2026-08-12",
      "locator": "Section 2107(a)",
      "source_url": "https://uscode.house.gov/view.xhtml?edition=prelim&req=granuleid%3AUSC-prelim-title28-section2107",
      "proposition": "Unless another provision of section 2107 applies, a civil notice of appeal must be filed within 30 days after entry of the judgment, order, or decree."
    },
    {
      "authority_id": "ca4r54b.authority.frcp-58-entry",
      "authority_type": "rule",
      "jurisdiction_id": "us.federal",
      "issuing_body_id": "us.courts.supreme-court",
      "precedential_status": "not_applicable",
      "official_source": true,
      "citation": "Fed. R. Civ. P. 58(a), (c)",
      "source_version": "2025-12-01",
      "checked_on": "2026-08-12",
      "locator": "Rule 58(a) and (c)",
      "source_url": "https://www.uscourts.gov/sites/default/files/document/federal-rules-of-civil-procedure.pdf",
      "proposition": "A judgment ordinarily must be set out in a separate document. When a separate document is required, entry occurs upon docket entry and the earlier of a compliant separate document or 150 days after docket entry."
    },
    {
      "authority_id": "ca4r54b.authority.frap-39-costs",
      "authority_type": "rule",
      "jurisdiction_id": "us.federal",
      "issuing_body_id": "us.courts.supreme-court",
      "precedential_status": "not_applicable",
      "official_source": true,
      "citation": "Fed. R. App. P. 39(a)(1)",
      "source_version": "2026-03-23",
      "checked_on": "2026-08-12",
      "locator": "Rule 39(a)(1)",
      "source_url": "https://www.ca4.uscourts.gov/rules/Rule39.html",
      "proposition": "When an appeal is dismissed, costs are taxed against the appellant unless the parties agree otherwise or the court orders otherwise."
    },
    {
      "authority_id": "ca4r54b.authority.kinsale",
      "authority_type": "case",
      "jurisdiction_id": "us.ca4",
      "issuing_body_id": "us.ca4.court.appeals",
      "precedential_status": "precedential",
      "official_source": true,
      "citation": "Kinsale Insurance Co. v. JDBC Holdings, Inc., 31 F.4th 870 (4th Cir. 2022)",
      "source_version": "2022-04-20",
      "checked_on": "2026-08-12",
      "locator": "Majority Parts I–II, official PDF pages 3–11; concurrence follows",
      "source_url": "https://www.ca4.uscourts.gov/opinions/211754.P.pdf",
      "proposition": "Rule 54(b) requires ultimate disposition of an individual claim and a case-specific no-just-reason determination. Certification is tilted against fragmentation and considers claim relationship, possible mootness, repeat appellate review, setoff, and other equities; stated findings support abuse-of-discretion review."
    },
    {
      "authority_id": "ca4r54b.authority.mcpherson",
      "authority_type": "case",
      "jurisdiction_id": "us.ca4",
      "issuing_body_id": "us.ca4.court.appeals",
      "precedential_status": "nonprecedential",
      "official_source": true,
      "citation": "McPherson v. Patton, No. 23-1938 (4th Cir. Oct. 15, 2024) (unpublished)",
      "source_version": "2024-10-15",
      "checked_on": "2026-08-12",
      "locator": "Official slip opinion pages 4–7",
      "source_url": "https://www.ca4.uscourts.gov/opinions/231938.U.pdf",
      "proposition": "In a nonprecedential disposition, a grant of a Rule 54(b) motion and partial judgment did not become final when the district court omitted the express no-just-reason determination; the appeal was dismissed and remanded."
    },
    {
      "authority_id": "ca4r54b.authority.bowles",
      "authority_type": "case",
      "jurisdiction_id": "us.federal",
      "issuing_body_id": "us.courts.supreme-court",
      "precedential_status": "precedential",
      "official_source": true,
      "citation": "Bowles v. Russell, 551 U.S. 205 (2007)",
      "source_version": "2007-06-14",
      "checked_on": "2026-08-12",
      "locator": "Official United States Reports, pages 209–214",
      "source_url": "https://www.govinfo.gov/content/pkg/USREPORTS-551/pdf/USREPORTS-551-205.pdf",
      "proposition": "The statutory time limit for filing a civil notice of appeal is jurisdictional and courts may not create equitable exceptions to it."
    },
    {
      "authority_id": "ca4r54b.authority.primov-condition-precedent",
      "authority_type": "case",
      "jurisdiction_id": "us.virginia",
      "issuing_body_id": "us.virginia.supreme-court",
      "precedential_status": "precedential",
      "official_source": true,
      "citation": "Primov v. Serco, Inc., 296 Va. 59 (2018)",
      "source_version": "2018-08-23",
      "checked_on": "2026-08-12",
      "locator": "Official opinion pages 4–7 and 10–11",
      "source_url": "https://www.courts.state.va.us/static/opinions/opnscvwp/1171381.pdf",
      "proposition": "Virginia enforces clear contractual conditions precedent. Contract interpretation is reviewed de novo, and denying a contracting party the benefit of an express prerequisite supports enforcement; the appropriate consequence for noncompliance depends on the contract and case circumstances."
    }
  ]
}
